{
  "registryId": "example-co",
  "domain": "exampleco.ca",
  "name": "Example Company",
  "location": {
    "country": "CA",
    "region": "ON",
    "city": "Perth"
  },
  "industry": "professional-services",
  "services": ["consulting", "software-development"],
  "profileUrl": "https://hub.vizai.io/p/example-co",
  "verification": {
    "status": "verified",
    "tier": "verified",
    "method": "domain-ownership",
    "lastVerified": "2025-01-06",
    "qualityScore": 95
  },
  "metadata": {
    "dateAdded": "2025-01-06",
    "lastUpdated": "2025-01-06"
  }
}