{
  "registryId": "vizai",
  "domain": "vizai.io",
  "name": "VizAI",
  "location": {
    "country": "CA",
    "region": "ON",
    "city": "Toronto"
  },
  "industry": "technology",
  "services": ["ai-governance", "visibility-monitoring", "business-intelligence"],
  "profileUrl": "https://hub.vizai.io/p/vizai",
  "verification": {
    "status": "verified",
    "tier": "verified",
    "method": "domain-ownership",
    "lastVerified": "2025-01-06",
    "qualityScore": 100
  },
  "metadata": {
    "dateAdded": "2025-01-06",
    "lastUpdated": "2026-01-11"
  }
}